id,listing_url,scrape_id,last_scraped,name,summary,space,description,experiences_offered,neighborhood_overview,notes,transit,access,interaction,house_rules,thumbnail_url,medium_url,picture_url,xl_picture_url,host_id,host_url,host_name,host_since,host_location,host_about,host_response_time,host_response_rate,host_acceptance_rate,host_is_superhost,host_thumbnail_url,host_picture_url,host_neighbourhood,host_listings_count,host_total_listings_count,host_verifications,host_has_profile_pic,host_identity_verified,street,neighbourhood,neighbourhood_cleansed,neighbourhood_group_cleansed,city,state,zipcode,market,smart_location,country_code,country,latitude,longitude,is_location_exact,property_type,room_type,accommodates,bathrooms,bedrooms,beds,bed_type,amenities,square_feet,price,weekly_price,monthly_price,security_deposit,cleaning_fee,guests_included,extra_people,minimum_nights,maximum_nights,calendar_updated,has_availability,availability_30,availability_60,availability_90,availability_365,calendar_last_scraped,number_of_reviews,first_review,last_review,review_scores_rating,review_scores_accuracy,review_scores_cleanliness,review_scores_checkin,review_scores_communication,review_scores_location,review_scores_value,requires_license,license,jurisdiction_names,instant_bookable,is_business_travel_ready,cancellation_policy,require_guest_profile_picture,require_guest_phone_verification,calculated_host_listings_count,reviews_per_month
2818,https://www.airbnb.com/rooms/2818,2.01812E+13,12/6/2018,Quiet Garden View Room & Super Fast WiFi,Quiet Garden View Room & Super Fast WiFi,"I'm renting a bedroom (room overlooking the garden) in my apartment in Amsterdam,  The room is located to the east of the city centre in a quiet, typical Amsterdam neighbourhood the ""Indische Buurt"". Amsterdam’s historic centre is less than 15 minutes away by bike or tram. The features of the room are: - Twin beds (80 x 200 cm, down quilts and pillows)  - 2 pure cotton towels for each guest  - reading lamps - bedside table - wardrobe - table with chairs - tea and coffee making facilities - mini bar - alarm clock - Hi-Fi system with cd player, connection for mp3 player / phone - map of Amsterdam and public transport - Wi-Fi Internet connection  Extra services: - Bike rental","Quiet Garden View Room & Super Fast WiFi I'm renting a bedroom (room overlooking the garden) in my apartment in Amsterdam,  The room is located to the east of the city centre in a quiet, typical Amsterdam neighbourhood the ""Indische Buurt"". Amsterdam’s historic centre is less than 15 minutes away by bike or tram. The features of the room are: - Twin beds (80 x 200 cm, down quilts and pillows)  - 2 pure cotton towels for each guest  - reading lamps - bedside table - wardrobe - table with chairs - tea and coffee making facilities - mini bar - alarm clock - Hi-Fi system with cd player, connection for mp3 player / phone - map of Amsterdam and public transport - Wi-Fi Internet connection  Extra services: - Bike rental Indische Buurt (""Indies Neighborhood"") is a neighbourhood in the eastern portion of the city of Amsterdam, in the Dutch province of Noord-Holland. The name dates from the early 20th century and is derived from the fact that the neighbourhood's streets are named after islands a",none,"Indische Buurt (""Indies Neighborhood"") is a neighbourhood in the eastern portion of the city of Amsterdam, in the Dutch province of Noord-Holland. The name dates from the early 20th century and is derived from the fact that the neighbourhood's streets are named after islands and other geographical concepts in the former Dutch colony of the Dutch East Indies. The first street was named in 1902. In 2003, there were around 23,357 inhabitants. The neighbourhood is bounded on the west by the railroad Amsterdam - Hilversum (with the Muiderpoort Station), on the east side by Flevopark, on the north side by Zeeburgerdijk and on the south side by the Ringvaart Watergraafsmeer. Indische Buurt is the oldest part of the Zeeburg district and is very ethnically diverse, and a high percentage of the population is of immigrant origin (for Zeeburg this is already high at 55%, but higher in the Indische Buurt) and there are an estimated 100 languages spoken.","From week 38 to week 47 maintenance work to the bulding, possible noise on weekdays (from 7:00 to 16:00)","The neighbourhood is well served by 24 hours public transport (2 trams and 4 buses).  Amsterdam is made for cycling. With special traffic lights and bicycle lanes, it is the fastest and cheapest way to travel in and around the city. Bicycle riding is also convenient, safe and lots of fun. Whatever your age, you will see more by bike!",,,Please: - Leave your shoes in the entrance  - Do not smoke in the apartment or in the common parts of the building - Feel free to leave your valuables in the room but at your own risk (in case of     lost I will not be responsible) - Keep a low volume between 22:00 and 8:00 - Do not open the door to strangers - Turn off electrical appliances and unplug devices & chargers when not in    the room - Before exiting make sure that the window of the room and the entrance door    are well locked and the alarm on.,,,https://a0.muscache.com/im/pictures/10272854/8dcca016_original.jpg?aki_policy=large,,3159,https://www.airbnb.com/users/show/3159,Daniel,9/24/2008,"Amsterdam, Noord-Holland, The Netherlands","Upon arriving in Amsterdam, one can imagine asking oneself: Where is the fun nightlife? What are the local hot spots? 

How can I experience the real life in this city? I  offer you the opportunity to act, eat and sleep like-a-local!  

I provide the traveler with the opportunity to connect with the local life in Amsterdam.",within an hour,100%,N/A,t,https://a0.muscache.com/im/users/3159/profile_pic/1259095323/original.jpg?aki_policy=profile_small,https://a0.muscache.com/im/users/3159/profile_pic/1259095323/original.jpg?aki_policy=profile_x_medium,Indische Buurt,1,1,"['email', 'phone', 'reviews', 'jumio', 'offline_government_id', 'selfie', 'government_id', 'identity_manual']",t,f,"Amsterdam, North Holland, Netherlands",Indische Buurt,Oostelijk Havengebied - Indische Buurt,,Amsterdam,North Holland,,Amsterdam,"Amsterdam, Netherlands",NL,Netherlands,52.36575451,4.941419235,f,Apartment,Private room,2,1.5,1,2,Real Bed,"{Internet,Wifi,""Paid parking off premises"",""Buzzer/wireless intercom"",Heating,Washer,""Smoke detector"",""Carbon monoxide detector"",""First aid kit"",""Safety card"",""Fire extinguisher"",Essentials,Shampoo,""Lock on bedroom door"",""24-hour check-in"",Hangers,""Hair dryer"",Iron,""Laptop friendly workspace"",""translation missing: en.hosting_amenity_49"",""translation missing: en.hosting_amenity_50"",""Private entrance"",""Hot water"",""Bed linens"",""Extra pillows and blankets"",""Single level home"",""Garden or backyard"",""Step-free access"",""Flat path to front door"",""Well-lit path to entrance"",""Step-free access"",""Accessible-height bed"",""Step-free access"",""Host greets you"",""Handheld shower head"",""Paid parking on premises""}",,$59.00 ,,"$1,500.00 ",$100.00 ,$50.00 ,1,$20.00 ,3,15,today,t,17,44,44,44,12/6/2018,248,3/30/2009,11/28/2018,97,10,10,10,10,9,10,f,,{Amsterdam},t,f,strict_14_with_grace_period,f,f,1,2.1
3209,https://www.airbnb.com/rooms/3209,2.01812E+13,12/6/2018,"Quiet apt near center, great view","You will love our spacious (90 m2) bright apartment with a monumental view: ""Het Schip"" is an architectural wonder that draws visitors from all over the world. It's on a quiet street, yet close to bars, restaurants, and the cozy Jordaan neighborhood. The Westerpark - good for running, picknicks, festivals - is at walking distance. The beach Zandvoort is only a 30 minute train ride from Amsterdam Central train station.","Our apartment has lots of light, a balcony and an office (or spare bedroom it you come with more than 2). You can play the grand piano if you like - and play with our (very sociable and well behaved) cat as well. When we bought this house, we fell in love with the view: Het Schip is an architectural wonder and has recently re-opened as a museum, highly recommneded. Our own residential complex was totally renovated during 2010/2011, bringing back the colors and brick structure of the original building. Since then the building is listed as a national monument.","You will love our spacious (90 m2) bright apartment with a monumental view: ""Het Schip"" is an architectural wonder that draws visitors from all over the world. It's on a quiet street, yet close to bars, restaurants, and the cozy Jordaan neighborhood. The Westerpark - good for running, picknicks, festivals - is at walking distance. The beach Zandvoort is only a 30 minute train ride from Amsterdam Central train station. Our apartment has lots of light, a balcony and an office (or spare bedroom it you come with more than 2). You can play the grand piano if you like - and play with our (very sociable and well behaved) cat as well. When we bought this house, we fell in love with the view: Het Schip is an architectural wonder and has recently re-opened as a museum, highly recommneded. Our own residential complex was totally renovated during 2010/2011, bringing back the colors and brick structure of the original building. Since then the building is listed as a national monument. You will have",none,"Welcome to the Spaarndammerbuurt! From the beginning of the 1900s, this was the ground zero of social housing in the Netherlands. It is still a very diverse neighborhood, but it has recently been renovated and is now a place where lots of young couples and families reside. Check out the lovey Zaanhof (courtyard) just around the corner of our house, which has a playing ground, and enjoy an afternoon with a book at the fountain. And when it's hot, check out the Bredius open air swimming pool - a 5 minute walk.  There are some great restaurants at walking distance, like Morris & Bella, Freud, Bar Mick and Pinsa's Pizzeria (all on Spaarndammerstraat). Jump on your bicycle and enjoy a fantastic view at the IJ river when dining at Pont 13 (boat) or on the upper floar of REM eiland. The Westerpark is very nearby, good for running, picknicks, festivals. And if you want even more activity, just head to the center, it's close!",,"From Central Station, walk towards the busstop across the train station. Take bus 22. After about 10 minutes, get off at stop 'Oostzaanstraat'. Cross the street towards Oostzaanstraat. Continue the street until you hit Hembrugstraat, turn right. Our house is on the first block. The walk is about 3 minutes.",You will have the entire house to yourself.,"We will meet you in person for check in whenever possible; if not, we leave the key at nearby Bar Mick. All instructions are on the table in the living room. You can leave the keys on the table when you check-out and just close the door behind you.  If you have any questions, don't hesitate to call us!","Our house comes with our very sweet, but old (17 years) cat Mel. He needs some extra tender loving care at his age and, if you stay more than 2 nights, we recommend you change his litter box... just for your own sake! ;-)  The municipality of Amsterdam has become VERY strict when it comes to Airbnb, so forgive us for being strict, too. We do not allow more than 4 people to stay in our house. Drug use is not allowed. Should we get any complaints of the neighbors during your stay, the reservation will be cancelled immediately, with no refund.  It would be great if you could take out the trash before you leave.",,,https://a0.muscache.com/im/pictures/88955424/496ae7bb_original.jpg?aki_policy=large,,3806,https://www.airbnb.com/users/show/3806,Maartje,10/24/2008,"Amsterdam, Noord-Holland, The Netherlands","I am a freelance radio producer and journalist. I have always stayed at other's people's places, in Cuba, Mexico, Vietnam, Sweden, Finland, France, Nepal, Indonesia, the US, to name but a few countries. I think it's the quickest way to feel at home - although I highly recommend going for a run in a new city, too! I hope you feel at home in my place. My cat Mel will help you do so - he has gotten great reviews so far!",within an hour,100%,N/A,f,https://a0.muscache.com/im/users/3806/profile_pic/1377163427/original.jpg?aki_policy=profile_small,https://a0.muscache.com/im/users/3806/profile_pic/1377163427/original.jpg?aki_policy=profile_x_medium,Spaarndammer en Zeeheldenbuurt,1,1,"['email', 'phone', 'reviews', 'jumio']",t,t,"Amsterdam, Noord-Holland, Netherlands",Spaarndammer en Zeeheldenbuurt,Westerpark,,Amsterdam,Noord-Holland,1013 XE,Amsterdam,"Amsterdam, Netherlands",NL,Netherlands,52.39022505,4.873924095,t,Apartment,Entire home/apt,5,1,2,2,Real Bed,"{Internet,Wifi,Kitchen,""Paid parking off premises"",""Pets live on this property"",Cat(s),Heating,""Family/kid friendly"",Washer,""Smoke detector"",""Fire extinguisher"",Essentials,Shampoo,Hangers,""Hair dryer"",Iron,""Laptop friendly workspace"",""Hot water"",""Coffee maker"",Refrigerator,Dishwasher,""Dishes and silverware"",""Cooking basics"",Oven,Stove,""Patio or balcony"",Other}",,$160.00 ,$543.00 ,"$2,000.00 ",$300.00 ,$40.00 ,2,$15.00 ,4,20,7 weeks ago,t,0,0,0,47,12/6/2018,42,7/31/2015,8/29/2018,96,10,9,10,10,9,9,f,,{Amsterdam},f,f,moderate,f,f,1,1.03
20168,https://www.airbnb.com/rooms/20168,2.01812E+13,12/6/2018,100%Centre-Studio 1 Private Floor/Bathroom,"Cozy studio on your own private floor, 100% in a lovely 17th century Dutch townhouse in the heart of the city. Located a stones throw from Rembrandt Square, Dam Square, Leidse Square and Flower Market. Walking distance from Central Station. Comfortable bed and with private bathroom, double glazed windows and night blackout curtains, flat screen TV and mini fridge, Wi-Fi but no kitchen. No bathtub only shower. No curfew.","For those who like all facets of city life. In the streets surrounding the house, there are lots of antique shops, and for those who are into browsing for antiques. The Rijksmuseum is a short walk away. The famous nine-streets with all its little boutique shops, cafes, restaurants and whatnot is also around the corner. The Dam Square, Leidse Square and Rembrandt Squarejust minutes to walk. No Curfew and you feel 100% privacy.  Hair dryer, towels and linens are included. Airport pick-up is possible at extra charge (ask for it)","Cozy studio on your own private floor, 100% in a lovely 17th century Dutch townhouse in the heart of the city. Located a stones throw from Rembrandt Square, Dam Square, Leidse Square and Flower Market. Walking distance from Central Station. Comfortable bed and with private bathroom, double glazed windows and night blackout curtains, flat screen TV and mini fridge, Wi-Fi but no kitchen. No bathtub only shower. No curfew. For those who like all facets of city life. In the streets surrounding the house, there are lots of antique shops, and for those who are into browsing for antiques. The Rijksmuseum is a short walk away. The famous nine-streets with all its little boutique shops, cafes, restaurants and whatnot is also around the corner. The Dam Square, Leidse Square and Rembrandt Squarejust minutes to walk. No Curfew and you feel 100% privacy.  Hair dryer, towels and linens are included. Airport pick-up is possible at extra charge (ask for it) No curfew, free entrance 27/7 with your own ",none,"Located just in between famous central canals. In the streets surrounding the house, there are lots of antique shops, and for those who are into browsing for antiques. The Rijksmuseum is a short walk away. The famous nine-streets with all its little boutique shops, cafes, restaurants and whatnot is also around the corner. The Dam Square, Leidse Square and Rembrandt Squarejust minutes to walk. No Curfew and you feel 100% privacy.  Hair dryer, towels and linens are included. No kitchen. Airport pick-up is possible at extra charge (ask for it)","Check-in time from 2pm till 10pm Checkout anytime before 11am Late check-in after 10pm is not always possible and extra charge might apply as for a early check-in before 2pm. HOW TO GET TO THE HOUSE: Take the train directly from the terminal of Schiphol airport (it runs every 10-15 minutes ) until Central Station. From Central station you can walk (if you don't have much of the luggage it will take 15-20 min.) or you can take a taxi (about €10). You can also take the tram which leaves from the Central Station until Muntplein. Total journey time from airport to my house takes about 40min (20min by train from airport to the central station, 10min by tram from central station to my house or 20min max walking). A Taxi from Schiphol airport may cost about €50-70.","No need to use any transport! All is within a walking distance! But if you like to use the local tram, the stop is just few meters away.",,"No curfew, free entrance 27/7 with your own keys. All rooms are lockable and you feel 100% privacy! Smoking, drugs and night party are strictly forbidden in the property!","This studio/room takes entire floor and has it own small bathroom. Please note we require you to contact us at-least 1-2 week before arrival with estimated arrival time as we do not have reception. Please contact us if you will be late. No curfew, free entrance 27/7 with your own keys.  No smoking house! No party house! No drugs! No night guests!",,,https://a0.muscache.com/im/pictures/69979664/3652fedc_original.jpg?aki_policy=large,,59484,https://www.airbnb.com/users/show/59484,Alex,12/2/2009,"Amsterdam, Noord-Holland, The Netherlands",Secondary phone nr. + (Phone number hidden by Airbnb) only in case if I do not reply),within a few hours,100%,N/A,f,https://a0.muscache.com/im/pictures/user/579c8f51-b7c2-4258-b462-5fdf346acfb4.jpg?aki_policy=profile_small,https://a0.muscache.com/im/pictures/user/579c8f51-b7c2-4258-b462-5fdf346acfb4.jpg?aki_policy=profile_x_medium,Grachtengordel,2,2,"['email', 'phone', 'reviews', 'jumio', 'offline_government_id', 'selfie', 'government_id', 'identity_manual']",t,f,"Amsterdam, North Holland, Netherlands",Grachtengordel,Centrum-Oost,,Amsterdam,North Holland,1017,Amsterdam,"Amsterdam, Netherlands",NL,Netherlands,52.36508703,4.893541008,t,Townhouse,Entire home/apt,2,1,1,1,Real Bed,"{TV,Internet,Wifi,""Paid parking off premises"",Heating,""Smoke detector"",""Carbon monoxide detector"",""Fire extinguisher"",Essentials,Shampoo,Hangers,""Hair dryer"",""Laptop friendly workspace"",""translation missing: en.hosting_amenity_49"",""translation missing: en.hosting_amenity_50"",""Hot water"",""Bed linens"",""Long term stays allowed"",""Host greets you""}",,$80.00 ,,,,,2,$0.00 ,1,1000,today,t,0,7,24,198,12/6/2018,233,3/2/2010,11/30/2018,87,9,10,9,9,10,9,f,,{Amsterdam},f,f,strict_14_with_grace_period,f,f,2,2.18
25428,https://www.airbnb.com/rooms/25428,2.01812E+13,12/6/2018,Lovely apt in City Centre (Jordaan),,"This nicely furnished, newly renovated apt  is very sunny, and spacious with 8 windows. The appliances are fairly new. There are two flat screen TVs, washing machine, dryer, dishwasher, laptop computer, Wi-fi, and high speed internet as well as a printer. The floors are wood thru out the apt. The large living room and bedroom are separated by a nice corridor.The living room has two sofas, and is very comfortable. Doors in all rooms, and lots of privacy. Lots of books and CDs. There is a bathroom with a tub, and a separate toilet. We have a new wood burning fireplace in the living room. Wonderful views of the Keizersgracht Canal and Wester Church in front, and trees and gardens in back. The apt is in a historic area, as well as a very convenient one. It is two blocks from the Anne Frank House. The neighborhood is filled with cafes, and restaurants, with a supermarket next door. There are also neighborhood shops like a laundry, cheese shop, etc. We are a few blocks from the Dam.  There a","This nicely furnished, newly renovated apt  is very sunny, and spacious with 8 windows. The appliances are fairly new. There are two flat screen TVs, washing machine, dryer, dishwasher, laptop computer, Wi-fi, and high speed internet as well as a printer. The floors are wood thru out the apt. The large living room and bedroom are separated by a nice corridor.The living room has two sofas, and is very comfortable. Doors in all rooms, and lots of privacy. Lots of books and CDs. There is a bathroom with a tub, and a separate toilet. We have a new wood burning fireplace in the living room. Wonderful views of the Keizersgracht Canal and Wester Church in front, and trees and gardens in back. The apt is in a historic area, as well as a very convenient one. It is two blocks from the Anne Frank House. The neighborhood is filled with cafes, and restaurants, with a supermarket next door. There are also neighborhood shops like a laundry, cheese shop, etc. We are a few blocks from the Dam.  There a",none,,,,The apartment is about 75 meters or 800 square feet.,,"The building is a quiet building, so please don't make noise in the evening.Thank you.",,,https://a0.muscache.com/im/pictures/138431/7079a93d_original.jpg?aki_policy=large,,56142,https://www.airbnb.com/users/show/56142,Joan,11/20/2009,"New York, New York, United States","We are a retired couple who live in NYC, and have an apt in Amsterdam which we love, where we spend a few months each year.
 (Phone number hidden by Airbnb)",within a few hours,100%,N/A,f,https://a0.muscache.com/im/users/56142/profile_pic/1367806389/original.jpg?aki_policy=profile_small,https://a0.muscache.com/im/users/56142/profile_pic/1367806389/original.jpg?aki_policy=profile_x_medium,Grachtengordel,2,2,"['email', 'phone', 'reviews']",t,f,"Amsterdam, North Holland, Netherlands",Grachtengordel,Centrum-West,,Amsterdam,North Holland,1016,Amsterdam,"Amsterdam, Netherlands",NL,Netherlands,52.3731144,4.883668196,f,Apartment,Entire home/apt,3,1,1,1,Real Bed,"{TV,""Cable TV"",Internet,Wifi,Kitchen,Elevator,""Indoor fireplace"",""Buzzer/wireless intercom"",Heating,""Family/kid friendly"",Washer,Dryer,""Smoke detector"",""Fire extinguisher"",Essentials,Hangers,""Hair dryer"",Iron,""Laptop friendly workspace""}",,$125.00 ,$650.00 ,"$2,000.00 ",$300.00 ,$40.00 ,2,$10.00 ,14,60,2 days ago,t,2,32,44,141,12/6/2018,1,1/21/2018,1/21/2018,100,10,10,10,10,10,10,f,,{Amsterdam},f,f,strict_14_with_grace_period,f,f,2,0.09
