27886,https://www.airbnb.com/rooms/27886,2.01812E+13,12/6/2018,"Romantic, stylish B&B houseboat in canal district","Stylish and romantic houseboat on fantastic historic location with breathtaking view. Your own entrance!  Wheelhouse, deckhouse and captains room. Central, quiet. Great breakfast, 2 vanMoof design bikes and a Canadian Canoe are included. Just read the reviews on tripadvisor for instance!","For a romantic couple: A beautifully restored traditional dutch barge, M.s. Luctor, with all modern comfords, your own entrance, three rooms,(sleeping room, deckhouse and wheelhouse) with two bikes and a canadian canoe to explore the city. Have your breakfast weather permitting on the large jetty. (You  might want to give a piece of your fresh fruit to our Greek turtle...) Organic products, a variety of cheese, fresh orange juice and croisants... We are member of green-hotels (ECEAT) and care for the enviroment. (We just installed solar pannels! A lot of questions can be answered on boat (Website hidden by Airbnb) there is a button with Frequently Asked Questions.)  The location is superb, fantastic view and everything that makes Amsterdam great,shops, restaurants, cafe's, red light district, musea, cinema's, theatre, is close by!  There is wifi available, but more important: we know the city and can help you to find whatever you're looking for. Central station is on foot aprox. ten mi","Stylish and romantic houseboat on fantastic historic location with breathtaking view. Your own entrance!  Wheelhouse, deckhouse and captains room. Central, quiet. Great breakfast, 2 vanMoof design bikes and a Canadian Canoe are included. Just read the reviews on tripadvisor for instance! For a romantic couple: A beautifully restored traditional dutch barge, M.s. Luctor, with all modern comfords, your own entrance, three rooms,(sleeping room, deckhouse and wheelhouse) with two bikes and a canadian canoe to explore the city. Have your breakfast weather permitting on the large jetty. (You  might want to give a piece of your fresh fruit to our Greek turtle...) Organic products, a variety of cheese, fresh orange juice and croisants... We are member of green-hotels (ECEAT) and care for the enviroment. (We just installed solar pannels! A lot of questions can be answered on boat (Website hidden by Airbnb) there is a button with Frequently Asked Questions.)  The location is superb, fantastic vi",none,"Central, quiet, safe, clean and beautiful.","we have a canadian canoe for you as well, free of charge, to explore the canals!","cental station aprox. 10 minutes on foot, busstop 80 meters away, and 2 bikes free of charge.","Your own apartment, nothing shared","As much as they want, and is possible. I speak english fluently, and french and german  reasonable...But it sounds good.","All the facilities  are included ( cleaning , towels , bed linen , heating , WIFI) .",,,https://a0.muscache.com/im/pictures/02c2da9d-660e-451d-8a51-2f7a17469df7.jpg?aki_policy=large,,97647,https://www.airbnb.com/users/show/97647,Flip,3/23/2010,"Amsterdam, Noord-Holland, The Netherlands","Marjan works in ""eye"" the dutch filmmuseum, and designs costumes for tv, film and theatre. Flip is an actor, mainly on stage, but also for film and tv. So for cultural advise, what to do, you are coming to the right place...

",within an hour,100%,N/A,t,https://a0.muscache.com/im/users/97647/profile_pic/1273275077/original.jpg?aki_policy=profile_small,https://a0.muscache.com/im/users/97647/profile_pic/1273275077/original.jpg?aki_policy=profile_x_medium,Westelijke Eilanden,1,1,"['email', 'phone', 'reviews', 'jumio']",t,t,"Amsterdam, North Holland, Netherlands",Westelijke Eilanden,Centrum-West,,Amsterdam,North Holland,1013,Amsterdam,"Amsterdam, Netherlands",NL,Netherlands,52.38672732,4.89207807,t,Houseboat,Private room,2,1,1,1,Real Bed,"{TV,Internet,Wifi,Breakfast,Heating,""Smoke detector"",""Carbon monoxide detector"",""Fire extinguisher"",Essentials,Shampoo,""24-hour check-in"",Hangers,""Hair dryer"",""Laptop friendly workspace"",""translation missing: en.hosting_amenity_49"",""translation missing: en.hosting_amenity_50"",""Self check-in"",""Smart lock"",""Private living room"",""Private entrance""}",,$150.00 ,$810.00 ,"$2,500.00 ",$0.00 ,$0.00 ,1,$0.00 ,2,730,today,t,16,37,54,199,12/6/2018,171,1/9/2012,11/25/2018,99,10,10,10,10,10,10,f,,{Amsterdam},t,f,strict_14_with_grace_period,f,f,1,2.03
28658,https://www.airbnb.com/rooms/28658,2.01812E+13,12/6/2018,Cosy guest room near city centre -1,"2 beds guest room in Amsterdam West near Erasmuspark, not far from city center and Jordan district. Tram lines are just out of the door. Be aware this is a room and not the entire apartment. A cat lives here as well. No smokers only. Please check carefully house rules before booking, house manual and itinerary after booking. Also be aware you must have reviews from previous Airbnb hosts and it is required to speak English.","Cosy small but comfortable guest room with twin beds in Amsterdam West (not the entire apartment), near the pretty Erasmus Park, not in the center but very close, 15 minutes by tram/bus from/to DAM and Central Station.  20 minutes walking to Jordaan district, home to many art galleries, particularly for modern art, and is also dotted with speciality shops and restaurants, is very closed. There are also some pretty good restaurants and caaffés in the neighborhood. Tram and bus lines are just out of the door, n. 14 to Jordaan (10 min), Dam (15 min) and Amsterdam Oost, n. 12 to Vondelpark (10min), Museumplein (15 min) and Sloterdijk (8 min, connection to Schiphol airport), n. 13 to Central Station (20 min). The apartment is on the 2nd floor of a typical Amsterdam building with a typical steep Amsterdam staircase, be aware of that when coming with big suitcases.  Bed sheets and towels are included. Check-in between 18.00 and 22.00, check-out before 12.00. I live in the apartment,  bathroom","2 beds guest room in Amsterdam West near Erasmuspark, not far from city center and Jordan district. Tram lines are just out of the door. Be aware this is a room and not the entire apartment. A cat lives here as well. No smokers only. Please check carefully house rules before booking, house manual and itinerary after booking. Also be aware you must have reviews from previous Airbnb hosts and it is required to speak English. Cosy small but comfortable guest room with twin beds in Amsterdam West (not the entire apartment), near the pretty Erasmus Park, not in the center but very close, 15 minutes by tram/bus from/to DAM and Central Station.  20 minutes walking to Jordaan district, home to many art galleries, particularly for modern art, and is also dotted with speciality shops and restaurants, is very closed. There are also some pretty good restaurants and caaffés in the neighborhood. Tram and bus lines are just out of the door, n. 14 to Jordaan (10 min), Dam (15 min) and Amsterdam Oost, ",none,"The listing is located in Amsterdam west, between Bos en Lommer and De Baarsjes, few minutes from the pretty Erasmuspark and 15 minutes walking from Jordaan district. There are different restaurant and cafes in the neighbourhood, including a ""Bagel and Beans"" just a few minutes away.","- When making a reservation please send a message with a brief description of yourself (age, profession, etc.) and a reason for the trip. -Recommendation from other hosts is required. - Smoking and bringing marijuana and hashish is not allowed. If you are a smoker, please consider another listing. I am allergic and the smell makes me sick, moreover, I had a bad experience with guests coming back stoned to the apartment. - Be aware there is a cat living in the apartment, in the case of allergies.  - The street can be quite noisy sometimes when keeping the windows open, so the place is not the best for people with sleeping problems, especially in the summertime. - The apartment is on the 2nd floor of a typical Amsterdam building with a typical steep Amsterdam staircase, be aware of that when coming with big suitcases.","Main tram/bus lines connecting to the city center and main train stations (in 10-20 minutes) are just out of the door, walking to the center is also possible, it takes 20/30 minutes.",Kitchen and living room can be used from 8am till 9pm.,I will be present at the listing in most of the cases. Guests will have their key and will be free to come and go as they like.,"Check-in is between 18.00 and 22.00, check-out before 11.00 am. I'm allergic to smoke, SMOKING IS ABSOLUTELY NOT ALLOWED, not even smoking at the window or bringing home drugs. Living room and kitchen can be used from 8.00 till 21.00. Kitchen is available for quick meals like salads, sandwiches, toasties, etc.; cooking is not allowed. Bathroom: please be swift, especially during rush hours, other guests may need to use the bathroom.  Please be conscious with the water consumption, save water = save life :-) Please no noise/laud talking after 22.00, other guests or neighbours may be sleeping. Also try to avoid showers after midnight if possible. Please keep the shared facilities (kitchen/shower/living) clean and tidy after using them. Washing machine and dryer are available during day time, cost is 6€ per wash, including the soap. Please keep bathroom available between 7.00 and 8.00am on working days.",,,https://a0.muscache.com/im/pictures/694776/7ac2156a_original.jpg?aki_policy=large,,123414,https://www.airbnb.com/users/show/123414,Michele,5/12/2010,"Amsterdam, Noord-Holland, The Netherlands","I'm Italian (from Sardinia) , I live in Amsterdam since 2000.

I work as freelance 3D designer and project manager for retail marketing.

I love good food, always looking for typical restaurants in every place I go, and I enjoy cooking with or for my friends.

I like outdoor sports (running, cycling), traveling, and riding my motorbike in the country side with no destination.

After several years living in this city I'm still in love with it, Amsterdam is so full of culture and hidden beautiful spots to discover, there is always something happening, from concerts to exhibitions, and more.

I discovered airbnb one year ago, I enjoy hosting my guests, make them feel home and help them with tips and advices.

Looking forward of having you as my guest :-)",within an hour,100%,N/A,f,https://a0.muscache.com/im/users/123414/profile_pic/1384361858/original.jpg?aki_policy=profile_small,https://a0.muscache.com/im/users/123414/profile_pic/1384361858/original.jpg?aki_policy=profile_x_medium,Bos en Lommer,2,2,"['email', 'phone', 'facebook', 'reviews', 'jumio']",t,t,"Amsterdam, Noord-Holland, Netherlands",Bos en Lommer,Bos en Lommer,,Amsterdam,Noord-Holland,1056,Amsterdam,"Amsterdam, Netherlands",NL,Netherlands,52.37534218,4.85728935,t,Apartment,Private room,2,1,1,2,Real Bed,"{TV,""Cable TV"",Internet,Wifi,""Paid parking off premises"",Breakfast,""Pets live on this property"",Cat(s),Heating,Washer,Dryer,""Smoke detector"",""First aid kit"",Essentials,Shampoo,""Lock on bedroom door"",Hangers,""Hair dryer"",Iron,""Laptop friendly workspace"",""translation missing: en.hosting_amenity_49"",""translation missing: en.hosting_amenity_50"",""Hot water"",""Bed linens"",""Host greets you""}",,$65.00 ,,,$150.00 ,$15.00 ,2,$0.00 ,3,15,2 months ago,t,11,29,52,295,12/6/2018,434,5/16/2010,11/19/2018,93,9,10,10,9,9,9,f,,{Amsterdam},f,f,moderate,t,t,2,4.16
28871,https://www.airbnb.com/rooms/28871,2.01812E+13,12/6/2018,Comfortable double room,,"In a monumental house right in the center of Amsterdam, we offer two rooms (one single room and one double room) to visitors who want to enjoy the comfort of a home-like accommodation, plus being in the middle of the historic city center, close to all important museums, shopping streets, restaurants, bars and clubs. Both rooms share a bathroom, have TV, DVD and access to free wifi internet. We are situated in the middle of the most important nightlife area of Amsterdam, which makes it a very vibrant place, but also a noisy place.  We accept all major credit cards.","In a monumental house right in the center of Amsterdam, we offer two rooms (one single room and one double room) to visitors who want to enjoy the comfort of a home-like accommodation, plus being in the middle of the historic city center, close to all important museums, shopping streets, restaurants, bars and clubs. Both rooms share a bathroom, have TV, DVD and access to free wifi internet. We are situated in the middle of the most important nightlife area of Amsterdam, which makes it a very vibrant place, but also a noisy place.  We accept all major credit cards.",none,,,,,,,,,https://a0.muscache.com/im/pictures/160889/362340f7_original.jpg?aki_policy=large,,124245,https://www.airbnb.com/users/show/124245,Edwin,5/13/2010,"Amsterdam, Noord-Holland, The Netherlands",Hi,within an hour,100%,N/A,t,https://a0.muscache.com/im/pictures/9986bbdb-632f-42b5-a866-8e3307184977.jpg?aki_policy=profile_small,https://a0.muscache.com/im/pictures/9986bbdb-632f-42b5-a866-8e3307184977.jpg?aki_policy=profile_x_medium,Amsterdam Centrum,3,3,"['email', 'phone', 'reviews', 'jumio']",t,t,"Amsterdam, North Holland, Netherlands",Amsterdam Centrum,Centrum-West,,Amsterdam,North Holland,1017,Amsterdam,"Amsterdam, Netherlands",NL,Netherlands,52.36718681,4.890917797,t,Apartment,Private room,2,,1,1,Real Bed,"{TV,""Cable TV"",Internet,Wifi,""Pets live on this property"",Cat(s),Heating,Washer,Dryer,""Smoke detector"",""Fire extinguisher"",Essentials,Shampoo,""Lock on bedroom door"",Hangers,""Hair dryer"",""Private entrance"",""Hot water"",""Host greets you""}",,$75.00 ,$499.00 ,"$1,956.00 ",,,1,$0.00 ,2,1825,yesterday,t,3,10,17,137,12/6/2018,215,8/22/2010,12/3/2018,97,10,10,10,10,10,10,f,,{Amsterdam},f,f,moderate,f,f,3,2.13
29051,https://www.airbnb.com/rooms/29051,2.01812E+13,12/6/2018,Comfortable single room,"because of the city imposing a 4 paying guest per night on hosts, i can not allow 2 people in the single rooms, so pls do not ask or let me know that there will be another person coming with you as i will not allow you to enter the house if you  do, a big fine and closure for a few weeks is too much of a risk for me to take  thanks","In a monumental house right in the center of Amsterdam, we offer two rooms (one single room and one double room) to visitors who want to enjoy the comfort of a home-like accommodation, plus being in the middle of the historic city center, close to all important museums, shopping streets, restaurants, bars and clubs. Both rooms share a bathroom, have TV, DVD and access to free wifi internet. We are situated in the middle of the most important nightlife area of Amsterdam, which makes it a very vibrant place, but also a noisy place.  We accept all major credit cards.","because of the city imposing a 4 paying guest per night on hosts, i can not allow 2 people in the single rooms, so pls do not ask or let me know that there will be another person coming with you as i will not allow you to enter the house if you  do, a big fine and closure for a few weeks is too much of a risk for me to take  thanks In a monumental house right in the center of Amsterdam, we offer two rooms (one single room and one double room) to visitors who want to enjoy the comfort of a home-like accommodation, plus being in the middle of the historic city center, close to all important museums, shopping streets, restaurants, bars and clubs. Both rooms share a bathroom, have TV, DVD and access to free wifi internet. We are situated in the middle of the most important nightlife area of Amsterdam, which makes it a very vibrant place, but also a noisy place.  We accept all major credit cards. the street is quite lively especially on weekends when the weather is good",none,the street is quite lively especially on weekends when the weather is good,,,,,,,,https://a0.muscache.com/im/pictures/162009/bd6be2f8_original.jpg?aki_policy=large,,124245,https://www.airbnb.com/users/show/124245,Edwin,5/13/2010,"Amsterdam, Noord-Holland, The Netherlands",Hi,within an hour,100%,N/A,t,https://a0.muscache.com/im/pictures/9986bbdb-632f-42b5-a866-8e3307184977.jpg?aki_policy=profile_small,https://a0.muscache.com/im/pictures/9986bbdb-632f-42b5-a866-8e3307184977.jpg?aki_policy=profile_x_medium,Amsterdam Centrum,3,3,"['email', 'phone', 'reviews', 'jumio']",t,t,"Amsterdam, North Holland, Netherlands",Amsterdam Centrum,Centrum-West,,Amsterdam,North Holland,1017,Amsterdam,"Amsterdam, Netherlands",NL,Netherlands,52.36772541,4.891511737,t,Apartment,Private room,1,1,1,1,Real Bed,"{TV,""Cable TV"",Internet,Wifi,""Smoking allowed"",""Pets allowed"",Heating,Washer,Dryer,""Smoke detector"",""Fire extinguisher"",Essentials,Shampoo,""Lock on bedroom door"",""Hair dryer"",""translation missing: en.hosting_amenity_49"",""translation missing: en.hosting_amenity_50"",""Private entrance"",""Hot water"",""Host greets you""}",,$55.00 ,$350.00 ,"$1,435.00 ",,,1,$0.00 ,2,730,today,t,1,10,18,188,12/6/2018,383,3/16/2011,12/5/2018,95,10,10,10,10,10,10,f,,{Amsterdam},f,f,moderate,f,f,3,4.07
31080,https://www.airbnb.com/rooms/31080,2.01812E+13,12/6/2018,2-story apartment + rooftop terrace,,"My apartment is light and cosy.  The three bedrooms are on the second floor, one main bedroom (double bed 160x200) and two single bedrooms (bed 90x200). On the third floor you'll be surprised to come into a sea of light with an open kitchen (incl. dishwasher, microwave, oven, washing machine) with a dining table (6) and sitting area with TV and music (and Wifi). Wooden floor. Doors to rooftop terrace with bamboo plants and flowers. Sun on terrace from dawn till about 18.00 hrs.  No noise from the street, other than now and then a car looking for a parking place and neighbours walking by.  Bathroom with toilet, shower and bath. Because of the stairs (two-three) not suitable for smaller children or elderly people.","My apartment is light and cosy.  The three bedrooms are on the second floor, one main bedroom (double bed 160x200) and two single bedrooms (bed 90x200). On the third floor you'll be surprised to come into a sea of light with an open kitchen (incl. dishwasher, microwave, oven, washing machine) with a dining table (6) and sitting area with TV and music (and Wifi). Wooden floor. Doors to rooftop terrace with bamboo plants and flowers. Sun on terrace from dawn till about 18.00 hrs.  No noise from the street, other than now and then a car looking for a parking place and neighbours walking by.  Bathroom with toilet, shower and bath. Because of the stairs (two-three) not suitable for smaller children or elderly people. Don't hesitate to contact me if you have any more inquieries. Cheerio, Nienke To reach my apartment from Schiphol, take the train (6 every hour) to Amsterdam Lelylaan (7 mnts) and from there take a cab (10 euro). Or you can take the train from Schiphol to train station Amsterda",none,,"Amsterdam and its surroundings are best explored by bicycle (there is one bike available for you). The Nieuwe Meer (for a swim) and the Amsterdamse Bos are nearby, take the route along the Schinkel.  To go to the beach, it will take you 45 mnts by train (every hour two trains leave for Zandvoort).  Parking your car in Amsterdam is quite expensive, the best way to come is by public transport.","To reach my apartment from Schiphol, take the train (6 every hour) to Amsterdam Lelylaan (7 mnts) and from there take a cab (10 euro). Or you can take the train from Schiphol to train station Amsterdam Zuid and catch bus 15.",,"Don't hesitate to contact me if you have any more inquieries. Cheerio, Nienke",The entire house is a NON-smoking area.,,,https://a0.muscache.com/im/pictures/5400242/371a2bd8_original.jpg?aki_policy=large,,133488,https://www.airbnb.com/users/show/133488,Nienke,5/27/2010,"Amsterdam, Noord-Holland, The Netherlands","(Hidden by Airbnb) Likes:
Orishas, Manu Chao, Jeff Buckley, Sergio Mendes, Jacques Brel, Gino Vanelli, John Legend, Stevie Wonder, Jamiroquai, Jason Mraz, James Morrison, Karel Glastra Van Loon, Khaled Hosseini, Connie Palmen, Paolo Coelho, Arthur Japin, Carlos Ruiz Zafón, Nicola Kraus, Pablo Neruda, Lao Tse, Peter Robb, Isabel Allende, Ayn Rand, Bill Pullman, Schindlers List, Jack Nicholson, Robert De Niro, Meryl Streep, Amsterdam, Netherlands, ReUseConnection, Netherlands Cricket, Greenpeace Nederland, tcktcktck, Coffee Break Spanish, Greenpeace International, Greenpeace UK, Fajardo, hector abad faciolince, Antanas Mockus, Avaaz, Villa Vallière, hockeynl, The Pink Ribbon, Iyengar YogaSchool Amsterdam",a few days or more,0%,N/A,f,https://a0.muscache.com/im/users/133488/profile_pic/1408538725/original.jpg?aki_policy=profile_small,https://a0.muscache.com/im/users/133488/profile_pic/1408538725/original.jpg?aki_policy=profile_x_medium,Hoofddorppleinbuurt,1,1,"['email', 'phone', 'facebook', 'reviews', 'jumio']",t,t,"Amsterdam, North Holland, Netherlands",Hoofddorppleinbuurt,Zuid,,Amsterdam,North Holland,1059,Amsterdam,"Amsterdam, Netherlands",NL,Netherlands,52.35132054,4.848382899,f,Apartment,Entire home/apt,4,1,3,3,Real Bed,"{TV,""Cable TV"",Internet,Wifi,Kitchen,""Buzzer/wireless intercom"",Heating,Washer,Dryer,""Smoke detector"",""Carbon monoxide detector"",""Fire extinguisher"",Essentials,Shampoo,""translation missing: en.hosting_amenity_49"",""translation missing: en.hosting_amenity_50"",Microwave,""Coffee maker"",Refrigerator,Dishwasher,""Dishes and silverware"",""Cooking basics"",Oven,Stove,""Patio or balcony"",""Host greets you""}",,$219.00 ,"$1,400.00 ","$4,000.00 ",,$60.00 ,4,$30.00 ,3,365,16 months ago,t,1,31,61,336,12/6/2018,32,8/6/2011,10/16/2017,95,9,10,10,10,9,9,f,,{Amsterdam},f,f,moderate,f,f,1,0.36
